<?xml version="1.0" encoding="UTF-8"?>
<Clientes xmlns:xsi="http://www.w3.org/2001/XMLSchema-instance" xsi:noNamespaceSchemaLocation="ClientesAvanzado.xsd">
    <Sede cod_sede="B7453564">
        <direccion>Calle La Oliva s/n, Jerez de la Frontera</direccion>
        <nom_empleado>Roberto Robles</nom_empleado>
        <fech_alta>2023-01-14</fech_alta>
        <cliente codigo="KRE-334">
            <descripcion>Solvente</descripcion>
            <numero>2</numero>
            <vivienda ID="001">
                <coste>120000</coste>
                <resumen>Piso a las afueras de Valencia</resumen>
                <plazo>27</plazo>
            </vivienda>
            <vivienda ID="002">
                <coste>480000</coste>
                <resumen>Pequeño Chalet con dos plantas y garage, cuenta con </resumen>
                <plazo>32</plazo>
            </vivienda>
        </cliente>
    </Sede>
    <Sede cod_sede="R2561780">
        <direccion>Calle Padre Luis Nº4, Algeciras</direccion>
        <nom_empleado>Pepe Viyuela</nom_empleado>
        <fech_alta>2022-03-23</fech_alta>
        <cliente codigo="DAN-948">
            <descripcion>Insolvente</descripcion>
            <numero>1</numero>
            <vivienda ID="003">
                <coste>950000</coste>
                <resumen>Chalet de tres plantas con un gran jardín, piscina y helipuerto</resumen>
                <plazo>48</plazo>
            </vivienda>
        </cliente>
    </Sede>
</Clientes>